{
  "version": "1.0.0",
  "exportDate": "2025-11-11T15:35:00.000Z",
  "fileKey": "MMMjqwWNYZAg0YlIeL9aJZ",
  "fileName": "Design System",
  "nodeId": "18491:30000",
  "nodeName": "Card",
  "node": {
    "id": "18491:30000",
    "name": "Card",
    "type": "FRAME",
    "visible": true,
    "locked": false,
    "width": 320,
    "height": 200,
    "x": 0,
    "y": 0,
    "rotation": 0,
    "opacity": 1,
    "layoutMode": "VERTICAL",
    "primaryAxisSizingMode": "AUTO",
    "counterAxisSizingMode": "FIXED",
    "primaryAxisAlignItems": "MIN",
    "counterAxisAlignItems": "MIN",
    "paddingLeft": 16,
    "paddingRight": 16,
    "paddingTop": 16,
    "paddingBottom": 16,
    "itemSpacing": 12,
    "fills": [
      {
        "type": "SOLID",
        "visible": true,
        "opacity": 1,
        "blendMode": "NORMAL",
        "color": {
          "r": 1,
          "g": 1,
          "b": 1,
          "a": 1
        }
      }
    ],
    "strokes": [
      {
        "type": "SOLID",
        "visible": true,
        "opacity": 1,
        "blendMode": "NORMAL",
        "color": {
          "r": 0.9,
          "g": 0.9,
          "b": 0.9,
          "a": 1
        }
      }
    ],
    "strokeWeight": 1,
    "strokeAlign": "INSIDE",
    "cornerRadius": 8,
    "effects": [
      {
        "type": "DROP_SHADOW",
        "visible": true,
        "radius": 8,
        "blendMode": "NORMAL",
        "color": {
          "r": 0,
          "g": 0,
          "b": 0,
          "a": 0.05
        },
        "offset": {
          "x": 0,
          "y": 4
        },
        "spread": 0,
        "showShadowBehindNode": false
      }
    ],
    "clipsContent": false,
    "children": [
      {
        "id": "18491:30001",
        "name": "Header",
        "type": "FRAME",
        "visible": true,
        "locked": false,
        "width": 288,
        "height": 32,
        "x": 16,
        "y": 16,
        "rotation": 0,
        "layoutMode": "HORIZONTAL",
        "primaryAxisSizingMode": "FIXED",
        "counterAxisSizingMode": "AUTO",
        "primaryAxisAlignItems": "SPACE_BETWEEN",
        "counterAxisAlignItems": "CENTER",
        "itemSpacing": 8,
        "fills": [],
        "clipsContent": false,
        "children": [
          {
            "id": "18491:30002",
            "name": "Title",
            "type": "TEXT",
            "visible": true,
            "locked": false,
            "width": 200,
            "height": 24,
            "x": 0,
            "y": 4,
            "rotation": 0,
            "characters": "Card Title",
            "fontSize": 18,
            "fontName": {
              "family": "Inter",
              "style": "SemiBold"
            },
            "fontWeight": 600,
            "textAlignHorizontal": "LEFT",
            "textAlignVertical": "TOP",
            "lineHeight": {
              "value": 24,
              "units": "PIXELS"
            },
            "fills": [
              {
                "type": "SOLID",
                "visible": true,
                "opacity": 1,
                "blendMode": "NORMAL",
                "color": {
                  "r": 0.1,
                  "g": 0.1,
                  "b": 0.1,
                  "a": 1
                }
              }
            ]
          },
          {
            "id": "18491:30003",
            "name": "Icon",
            "type": "FRAME",
            "visible": true,
            "locked": false,
            "width": 24,
            "height": 24,
            "x": 264,
            "y": 4,
            "rotation": 0,
            "fills": [],
            "cornerRadius": 4,
            "children": []
          }
        ]
      },
      {
        "id": "18491:30004",
        "name": "Content",
        "type": "TEXT",
        "visible": true,
        "locked": false,
        "width": 288,
        "height": 60,
        "x": 16,
        "y": 60,
        "rotation": 0,
        "characters": "This is the card content area with some descriptive text that explains what the card is about.",
        "fontSize": 14,
        "fontName": {
          "family": "Inter",
          "style": "Regular"
        },
        "fontWeight": 400,
        "textAlignHorizontal": "LEFT",
        "textAlignVertical": "TOP",
        "lineHeight": {
          "value": 20,
          "units": "PIXELS"
        },
        "fills": [
          {
            "type": "SOLID",
            "visible": true,
            "opacity": 1,
            "blendMode": "NORMAL",
            "color": {
              "r": 0.4,
              "g": 0.4,
              "b": 0.4,
              "a": 1
            }
          }
        ]
      },
      {
        "id": "18491:30005",
        "name": "Footer",
        "type": "FRAME",
        "visible": true,
        "locked": false,
        "width": 288,
        "height": 40,
        "x": 16,
        "y": 144,
        "rotation": 0,
        "layoutMode": "HORIZONTAL",
        "primaryAxisSizingMode": "FIXED",
        "counterAxisSizingMode": "AUTO",
        "primaryAxisAlignItems": "MIN",
        "counterAxisAlignItems": "CENTER",
        "itemSpacing": 8,
        "fills": [],
        "children": [
          {
            "id": "18491:30006",
            "name": "Button",
            "type": "INSTANCE",
            "visible": true,
            "locked": false,
            "width": 100,
            "height": 36,
            "x": 0,
            "y": 2,
            "rotation": 0,
            "mainComponent": {
              "id": "18491:22435",
              "key": "button-primary",
              "name": "Button/Primary"
            },
            "componentProperties": {
              "text": "Action"
            },
            "children": []
          }
        ]
      }
    ]
  }
}
